{
  "id": 10, 
  "title": "Common sensitive file", 
  "severity": "low", 
  "description": [
    "Web applications are often made up of multiple files and directories.", 
    "It is possible that over time some files may become unreferenced", 
    "(unused) by the web application and forgotten about by the", 
    "administrator/developer. Because web applications are built using", 
    "common frameworks, they contain common files that can be discovered", 
    "(independent of server).\n\nDuring the initial recon stages of an", 
    "attack, cyber-criminals will attempt to locate unreferenced files in", 
    "the hope that the file will assist in further compromise of the web", 
    "application. To achieve this they will make thousands of requests", 
    "using word lists containing common filenames. The response headers", 
    "from the server will then indicate if the file exists.\n\nThe tool also", 
    "contains a list of common file names which it will attempt to access."
  ], 
  "fix": {
    "effort": 50, 
    "guidance": [
      "If files are unreferenced then they should be removed from the web", 
      "root and/or the application directory.\n\nPreventing access without", 
      "authentication may also be an option and can stop a client from being", 
      "able to view the contents of a file, however it is still likely that", 
      "the directory structure will be able to be discovered.\n\nUsing obscure", 
      "file names is implementing security through obscurity and is not a", 
      "recommended option."
    ]
  }, 
  "tags": [
    "web",
    "common", 
    "path", 
    "file", 
    "discovery"
  ], 
  "references": [
    {
      "url": "http://httpd.apache.org/docs/2.0/mod/mod_access.html", 
      "title": "Apache.org"
    }
  ]
}