{
  "id": 34, 
  "title": "Blind NoSQL Injection (differential analysis)", 
  "severity": "high", 
  "description": [
    "A NoSQL injection occurs when a value originating from the client's", 
    "request is used within a NoSQL call without prior sanitisation.\n\nThis", 
    "can allow cyber-criminals to execute arbitrary NoSQL code and thus", 
    "steal data, or use the additional functionality of the database server", 
    "to take control of further server components.\n\nThe tool discovered that", 
    "the affected page and parameter are vulnerable. This injection was", 
    "detected as the tool was able to inject specific NoSQL queries that if", 
    "vulnerable result in the responses for each injection being different.", 
    "This is known as a blind NoSQL injection vulnerability."
  ], 
  "fix": {
    "effort": 50, 
    "guidance": [
      "The most effective remediation against NoSQL injection attacks is to", 
      "ensure that NoSQL API calls are not constructed via string", 
      "concatenation that includes unsanitized data.\n\nSanitization is best", 
      "achieved using existing escaping libraries."
    ]
  }, 
  "cwe": ["89"],
  "tags": [
    "web",
    "nosql", 
    "blind", 
    "injection", 
    "database"
  ], 
  "references": [
    {
      "url": "https://www.owasp.org/index.php/Testing_for_NoSQL_injection", 
      "title": "OWASP"
    }
  ]
}