{
  "id": 68,
  "title": "ShellSock",
  "severity": "high",
  "description": [
    "GNU Bash through 4.3 processes trailing strings after function",
    "definitions in the values of environment variables, which allows remote",
    "attackers to execute arbitrary code via a crafted environment, as",
    "demonstrated by vectors involving the ForceCommand feature in OpenSSH",
    "sshd, the mod_cgi and mod_cgid modules in the Apache HTTP Server, scripts",
    "executed by unspecified DHCP clients, and other situations in which",
    "setting the environment occurs across a privilege boundary from Bash",
    "execution, aka 'ShellShock'"
  ],
  "fix": {
    "effort": 60,
    "guidance": [
      "Upgrade Bash to version 4.3.025 or newer"
    ]
  }, 
  "tags": [
    "bash",
    "shellshock"
  ],
  "references": [
    {
     "url": "https://web.nvd.nist.gov/view/vuln/detail?vulnId=CVE-2014-6271",
     "title": "CVE-2014-6271"
    },
    {
      "url": "https://en.wikipedia.org/wiki/Shellshock_%28software_bug%29",
      "title": "Wikipedia article for Shellshock"
    }
  ]
}