{
  "id": 74,
  "title": "Phishing vector",
  "severity": "low",
  "description": [
    "The web user interface (UI) does not properly represent critical",
    "information to the user, allowing the information - or its source -",
    "to be obscured or spoofed. This is often a component in phishing attacks.",
    "\n\n",
    "If an attacker can cause the UI to display erroneous data, or to otherwise",
    "convince the user to display information that appears to come from a",
    "trusted source, then the attacker could trick the user into performing the",
    "wrong action. An example of this vulnerability is the possibility to",
    "control the `src` attribute of an iframe tag using a query string",
    "parameter."
  ],
  "fix": {
    "effort": 30,
    "guidance": [
      " * Review the generated HTML source and ensure that none of it's sections",
      "can be used in a UI misrepresentation attack.\n",
      "* Perform strict data validation (e.g. syntax, length, etc.) before",
      "using the user-provided data to render HTML pages.\n"
    ]
  },
  "cwe": ["451"],
  "tags": [
    "web",
    "phishing"
  ],
  "references": [
    {
      "url": "https://www.owasp.org/index.php/Phishing",
      "title": "Phishing - OWASP"
    }
  ]
}