{
  "id": 5, 
  "title": "CAPTCHA protected form", 
  "severity": "informational", 
  "description": [
    "To prevent the automated abuse of a page, applications can implement", 
    "what is known as a CAPTCHA.\n\nThese are used to ensure human", 
    "interaction with the application and are often used on forms where the", 
    "application conducts sensitive actions. These typically include user", 
    "registration, or submitting emails via \"Contact Us\" pages etc.", 
    "The tool has flagged this not as a vulnerability, but as a prompt for", 
    "the penetration tester to conduct further manual testing on the", 
    "CAPTCHA function, as The tool cannon audit CAPTCHA protected forms.", 
    "Testing for insecurely implemented CAPTCHA is a manual process, and an", 
    "insecurely implemented CAPTCHA could allow a cyber-criminal a means to", 
    "abuse these sensitive actions."
  ], 
  "fix": {
    "effort": 50, 
    "guidance": [
      "Although no remediation may be required based on this finding alone,", 
      "manual testing should ensure that:\n",
      "1. The server keeps track of CAPTCHA tokens in use and has the token",
      "terminated after its first use or after a period of time. Therefore",
      "preventing replay attacks.\n",
      "2. The CAPTCHA answer is not hidden in plain text within the response", 
      "that is sent to the client.\n",
      "3. The CAPTCHA image should not be weak and easily solved.\n"
    ]
  }
}